idea title,idea description,skills,difficulty,duration
Improve Robustness of Mifos X and Apache Fineract by Fixing Issues/Feature Requests in Backlog,Mentors @ Rahul Goel @ Manthan Surkar @ Aleksandar Vidakovic,"HTML , Spring , Hibernate , REST , Java , AngularJS , Javascript , SQL",Large,350 hours
Phase 2 of Lombok to Reduce Boilerplate Code and Mapstruct to map REST DTO to Entity Objects,Mentors @ Aleksandar Vidakovic,"Java , Spring , Gradle , refactoring large code bases , testing",Large,350 hours
Mobile Check Deposit Proof of Concept Using Moov Image Cash Letter,Mentors @ Victor Romero,"Java , Android , Kotlin , Compose , Go",Large,350 hours
Plugin Framework for Integration with External Decisioning Engines,Mentors @ Aleksandar Vidakovic,"Java , Spring , Angular , PostgreSQL , MySQL/MariaDB , REST",Large,350 hours
Micro Front-End Framework and UI Components for Web and Mobile Apps,Mentors @ Aleksandar Vidakovic,"JS , Android , Angular , E2E testing , Cucumber",Large,350 hours
Digital Identity Proof of Concept with MOSIP,Mentors @ Ed Cable @ Avik Ganguly @ Paras Dhama,"HTML , Spring , Hibernate , REST , Java , AngularJS , Javascript , SQL , MOSIP",Large,350 hours
Machine Learning Scorecard for Credit Risk Assessment Phase 6 (AI),Mentors @ Lalit Mohan S @ Abhijit Ramesh @ Nasser Kaze,"JAVA , Integrating Backend Service , MIFOS X , Apache Fineract , AngularJS , ORM , ML , Statistical Methods , Django",Large,350 hours
Digital Bank UI using New Micro Front-End Components,"Mentors @ Gaurav Saini , @ Pranjal Goswami , @ Maulik Soneji , @ Giorgio Zoppi",CategoryWeb - Micro Front-Ends ( Update ),Update,
